{
  "$schema": "https://raw.githubusercontent.com/mmdemirbas/html-doc/main/kit/schema/project-kit.schema.json",
  "name": "oku",
  "description": "Interactive knowledge platform for AI-emitted documentation, learning notes, and reviews.",
  "accent": "teal",
  "audience": "Author",
  "domains": ["data-platforms", "web", "ai-llm", "doc-tooling"],
  "lang": "en",
  "lang_fallback": ["en"],
  "languages": [
    { "code": "en", "label": "English" },
    { "code": "tr", "label": "Türkçe" }
  ],
  "defaultLanguage": "en"
}
